{"artifact_id":"artifact:705163c2d401e60115dce5bd457d8e31d77b275ff155205cbefd58a6cf68f7d9","format_version":1,"graph":{"artifact_id":"artifact:705163c2d401e60115dce5bd457d8e31d77b275ff155205cbefd58a6cf68f7d9","format_version":1,"index_object_id":"8cdf4d04768673615805bf06420e16d11e836aa7c83852f290d8cf30ae817be7","labels":[{"cluster":"cluster:0d9f12797b321c0284ca972801bd6306","object_id":"a51404319cf8d937cdcb6c749af426a269ad1c4a5ccc60678bcb927bb2fe03b4"},{"cluster":"cluster:2b0d4344a2940470bda98c31e0806b23","object_id":"03e3ab39a8b69105fec3c2c6a22c301b2a36e0b8f7b9f0088df359939f68dd0f"},{"cluster":"cluster:684071614467a2a5310d3736320a90e0","object_id":"f79f6c4aae256f69f13b768ece2348a494948f145e01aadbc05c3a14437b208d"},{"cluster":"cluster:72687ae74ec9ed33fbbdd74906b8a774","object_id":"2304c104db2dd3a7720777a5700321dccae8cdcea8f5180831bbdb5eb1f8bc21"},{"cluster":"cluster:848b982918ded24849bf4842c78a6efb","object_id":"c2a1683474e8cfab8c0f0cf263bbee04154f1d073a4d854017f53786fd92d901"},{"cluster":"cluster:8a3c618d930a5bee09b5a895aa89dd75","object_id":"5132bbd3c055790e775272527555743150c6feba2ea776b198c36a80ebf91e70"},{"cluster":"cluster:b3b73703416b24b40995a9329d4fbdaa","object_id":"9d1f45bc145148e25a0b8ac49f26f7e22998de8f8f1108388fa29f649ebe76fd"},{"cluster":"cluster:c385ca38682ec4e9e4054375bed0ae86","object_id":"a7d7dee26c45fe8fe0b47c7183ced7bbe50dc1405cc3346e39aee9396637214c"},{"cluster":"cluster:cc8ee7f961b1adc8739abf2971ee6c5b","object_id":"357f0ad7e2cadd438996d1e20fc57ea1d3ce89945612d402a6afa81f49d7d340"},{"cluster":"cluster:edd0f7da6d4493ae218a33c72109e787","object_id":"db6f9b5c816473d1f56e777400ff72a9e6b8792b918cceae43f3373498ac86e1"},{"cluster":"cluster:f41f05710d41f3931cc14a4c34aa4f4f","object_id":"3d136de98784e5679e5ecb661e28edde6a08823d3097d0ccfe1b8d6c9f704d46"},{"cluster":"cluster:fc018ddf98a0502fe9b6baba1cf26c1d","object_id":"8b33f8d36540b08f8cf5b35e595be8d4bf01d8198f7dd7ac80afe79c46966fcd"}]},"names":"a49a6e557554692b233e70d7f014aeadfe3e2ecea7ca5162c5e2114abe57e1f1","objects":[{"bytes":1058,"encoding":"cbor","object_id":"3c8305337c353cbc91c22f9a4d5e458427388c41a86191588a6f1fddf1daf54c","role":"chunk"},{"bytes":1242,"encoding":"cbor","object_id":"7edff698b94dc324cede78f74bda5da55ed8df03488495c0eae0e9e6ea9f0b9d","role":"chunk"},{"bytes":2030,"encoding":"cbor","object_id":"c9c4317428d11efd558d79d2d033e0841a854dd68228741eaa3dad00a50be29e","role":"chunk"},{"bytes":1786,"encoding":"cbor","object_id":"8cdf4d04768673615805bf06420e16d11e836aa7c83852f290d8cf30ae817be7","role":"graph_index"},{"bytes":367,"encoding":"cbor","object_id":"03363f6592a22cc9eec4c0a5649a796bb5b85a15aa6da7dac6c94cddecc20fcc","role":"graph_tile"},{"bytes":142,"encoding":"cbor","object_id":"0d1cf78ce3233c4aa1210bba152618da5cc3d4527f9b40417eb425a4f4f6321f","role":"graph_tile"},{"bytes":142,"encoding":"cbor","object_id":"115226911551faa2969316d6ea28714e1003088e452c437cf4011f1afa4b0b9c","role":"graph_tile"},{"bytes":142,"encoding":"cbor","object_id":"247566501eab95889c87b2b7bb3d355c2e2c08963b1382f8933019af6135bc16","role":"graph_tile"},{"bytes":142,"encoding":"cbor","object_id":"2628f43ae43794220d6c2a4ed2a29090607ad5a56da3852ea92dc75a6b6cbb22","role":"graph_tile"},{"bytes":142,"encoding":"cbor","object_id":"2aec89114df804534fb915384358df4ff1aa6c3a582a7bd4a0415dc43c44ff33","role":"graph_tile"},{"bytes":142,"encoding":"cbor","object_id":"40feb3c92ea5736a33c59b50b3643c9ab4769af8a3aa5bb6f490899dff0939c1","role":"graph_tile"},{"bytes":367,"encoding":"cbor","object_id":"55e1404858d692c267cb0fcbd6ba6a53824145a71e83fc0362ad82262cabf5a6","role":"graph_tile"},{"bytes":142,"encoding":"cbor","object_id":"5a59d3575efc3f4d9b9f74040a406df430df29182fb85d80da562445ed707eb6","role":"graph_tile"},{"bytes":1245,"encoding":"cbor","object_id":"6824056006eb388ea1be75b7eb4447aab797be75de89fc118063e536e26f1fe1","role":"graph_tile"},{"bytes":367,"encoding":"cbor","object_id":"72280c4a38224b556f5a8c566431a06ab05d3c37e42d23f3e88c03213bad1778","role":"graph_tile"},{"bytes":293,"encoding":"cbor","object_id":"7e4ef6c7240c4e2c490b1c5bc95b51a606d6a22c9d5f9867cf1c6c7d3bd53c70","role":"graph_tile"},{"bytes":142,"encoding":"cbor","object_id":"8c94163076bf7fdcf9105a304fd133d0c0d95a26bf38e9da62262aefe7ba313b","role":"graph_tile"},{"bytes":336,"encoding":"cbor","object_id":"91dea4ddba7db1bf5e82bbb7328d0bc14bc2dd01fbc049ec7fe6a1d57f11956d","role":"graph_tile"},{"bytes":142,"encoding":"cbor","object_id":"99e8bace799978372a5e679bbd3274983c9b003036e3ca7baa9eddf718eec8aa","role":"graph_tile"},{"bytes":217,"encoding":"cbor","object_id":"aa5da3781e150d2b53f4b25651c9924e3eaa655e0ddb4f9d61ad4ccb7b619ddb","role":"graph_tile"},{"bytes":217,"encoding":"cbor","object_id":"b20e128126b01723b13bf10c338c096a179d32738b688c0b9451c6b3380c6e5d","role":"graph_tile"},{"bytes":217,"encoding":"cbor","object_id":"b618b587db1652989e328051f946ca588f54421aaa33cace4d0ac181ff213f73","role":"graph_tile"},{"bytes":142,"encoding":"cbor","object_id":"bdf873cefae504a0d551c63b5a471ef7d5bc4bdc874b6bd5a3d26f3363e7c3a0","role":"graph_tile"},{"bytes":410,"encoding":"cbor","object_id":"c558eb850163a2fe8ec181b2f1dda31c6720723ac90ece672158e4208659df3a","role":"graph_tile"},{"bytes":426,"encoding":"cbor","object_id":"cc72b610e2c2128448070f0a09d7e00c8f0cebca8850d69e55a16e638e340cce","role":"graph_tile"},{"bytes":217,"encoding":"cbor","object_id":"e4087b4b11aea8d96efb56581e831e22d04ce9cecb0b37eaabe46bfc628335df","role":"graph_tile"},{"bytes":142,"encoding":"cbor","object_id":"eb59124444d1c0b915ec3649f563fe448cb37e9206ac40145e7edb477c78ea5e","role":"graph_tile"},{"bytes":142,"encoding":"cbor","object_id":"ef986c393bd6e97fc5a76920e1e1acc5fe5f8f43f27d3638e8765eb95a57184e","role":"graph_tile"},{"bytes":217,"encoding":"cbor","object_id":"f8efa5333da2377ed71212818c80db32b56938c50415995bf85946c78354cb70","role":"graph_tile"},{"bytes":123,"encoding":"cbor","object_id":"03e3ab39a8b69105fec3c2c6a22c301b2a36e0b8f7b9f0088df359939f68dd0f","role":"labels"},{"bytes":119,"encoding":"cbor","object_id":"2304c104db2dd3a7720777a5700321dccae8cdcea8f5180831bbdb5eb1f8bc21","role":"labels"},{"bytes":122,"encoding":"cbor","object_id":"357f0ad7e2cadd438996d1e20fc57ea1d3ce89945612d402a6afa81f49d7d340","role":"labels"},{"bytes":77,"encoding":"cbor","object_id":"3d136de98784e5679e5ecb661e28edde6a08823d3097d0ccfe1b8d6c9f704d46","role":"labels"},{"bytes":121,"encoding":"cbor","object_id":"5132bbd3c055790e775272527555743150c6feba2ea776b198c36a80ebf91e70","role":"labels"},{"bytes":121,"encoding":"cbor","object_id":"8b33f8d36540b08f8cf5b35e595be8d4bf01d8198f7dd7ac80afe79c46966fcd","role":"labels"},{"bytes":120,"encoding":"cbor","object_id":"9d1f45bc145148e25a0b8ac49f26f7e22998de8f8f1108388fa29f649ebe76fd","role":"labels"},{"bytes":77,"encoding":"cbor","object_id":"a51404319cf8d937cdcb6c749af426a269ad1c4a5ccc60678bcb927bb2fe03b4","role":"labels"},{"bytes":122,"encoding":"cbor","object_id":"a7d7dee26c45fe8fe0b47c7183ced7bbe50dc1405cc3346e39aee9396637214c","role":"labels"},{"bytes":120,"encoding":"cbor","object_id":"c2a1683474e8cfab8c0f0cf263bbee04154f1d073a4d854017f53786fd92d901","role":"labels"},{"bytes":173,"encoding":"cbor","object_id":"db6f9b5c816473d1f56e777400ff72a9e6b8792b918cceae43f3373498ac86e1","role":"labels"},{"bytes":120,"encoding":"cbor","object_id":"f79f6c4aae256f69f13b768ece2348a494948f145e01aadbc05c3a14437b208d","role":"labels"},{"bytes":1054,"encoding":"cbor","object_id":"705163c2d401e60115dce5bd457d8e31d77b275ff155205cbefd58a6cf68f7d9","role":"manifest"},{"bytes":1378,"encoding":"cbor","object_id":"a49a6e557554692b233e70d7f014aeadfe3e2ecea7ca5162c5e2114abe57e1f1","role":"names"},{"bytes":1320,"encoding":"json","object_id":"8ce421330bc7281a755b53baca1836c1cdfffb0ba600347c9cbff2e177081e63","role":"relation_index"},{"bytes":322,"encoding":"json","object_id":"10870cc2d3b168532a9c2ddae1a49ebba1cc1b8074c15ead4726d61e55e76ea9","role":"relation_part"},{"bytes":6878,"encoding":"json","object_id":"33c00a75e73477d9c7c5e15f961d7bb605b97b78f67c8b3ea4e2ce61164adec6","role":"relation_part"},{"bytes":8751,"encoding":"json","object_id":"457cacddfe7bf0d75e0ab670d7bb2d108d26915cc41f30aa792b885b2ac5513d","role":"relation_part"},{"bytes":3538,"encoding":"json","object_id":"8bf9a7ba04ad2e98d8c1d3ed719dcae41b06ec5c3063eabce7fe996b2c37ec80","role":"relation_part"},{"bytes":2700,"encoding":"json","object_id":"8cab6987e0551d981ce033d045304b342e59e5afebc2e4d8a810866371841ef1","role":"relation_part"},{"bytes":3152,"encoding":"json","object_id":"940067bb6b8f9a1b6c8c3009f7de1842ae2f3c82bc9beac8209075d1f7e4cfd3","role":"relation_part"},{"bytes":587,"encoding":"json","object_id":"a1779602185771c0d20ad17e3ead56a8b5e931cc8da023f23e80fa37d2f18672","role":"relation_part"},{"bytes":5994,"encoding":"json","object_id":"c343ebcbe65387ce6bb64a4fb8e7b784e751bb7210d2146f7ea2f2ccc7f2e8b9","role":"relation_part"},{"bytes":2244,"encoding":"json","object_id":"64b2028d00248d218220beb9fb58811568a8d6be88c64ba4b7f68bcc8c142a22","role":"summary"},{"bytes":63,"encoding":"cbor","object_id":"28a0ba657605b18149c5b48bcd7eca7d3ab5ebc4f00d5c4c8be99617a3fdf411","role":"tombstones"}],"relation_index":"8ce421330bc7281a755b53baca1836c1cdfffb0ba600347c9cbff2e177081e63","summary":"64b2028d00248d218220beb9fb58811568a8d6be88c64ba4b7f68bcc8c142a22"}